{
  "$schema": "urn:agent-team:schema:adapter-descriptor:1.0.0",
  "schema_version": "1.0.0",
  "adapter_id": "adapter.container-use",
  "adapter_version": "0.8.0",
  "status": "EXPERIMENTAL",
  "ports": ["sandbox"],
  "core_contract_versions": {"minimum": "1.0.0", "maximum_exclusive": "2.0.0"},
  "external_product": {"name": "Container Use", "version": "8901a77bd80fbd0e3a867e4ac44aabf89588f377", "api_version": "MCP"},
  "capabilities": ["sandbox.execute", "sandbox.workspace-checkpoint"],
  "permissions": ["worker:external-runtime"],
  "limitations": ["Not eligible: the exposed MCP workflow does not itself prove the Factory network, resource, credential and cleanup hard gates."],
  "timeouts": {"connect_seconds": 60, "operation_seconds": 3600, "cancel_seconds": 30},
  "idempotency": [{"port": "sandbox", "mode": "at-most-once"}],
  "health_check": {"mode": "composite", "timeout_seconds": 60}
}
